{
  "id": "13.01",
  "title": "Enterprise Agent Control Plane",
  "module": "13",
  "level": "advanced",
  "duration_minutes": 90,
  "prerequisites": [
    "12-governance-scaling"
  ],
  "outcomes": [
    "Separate enterprise control plane from application logic",
    "Design shared trustworthy-AI services",
    "Define extension and tenancy boundaries"
  ],
  "artifacts": [
    "curriculum/13-enterprise-architecture/01-enterprise-control-plane/artifacts/artifact.json"
  ]
}
